,episode_id,number,timestamp_in_ms,raw_character_text,raw_location_text,spoken_words
152451,12,256,1206000,Sideshow Bob,TV Studio,"And shot me out of a cannon. Yes, we will never forget that will we? Bart, open your heart. I admit I have some mighty big shoes to fill, but if you give me a chance, I promise you won't be disap..."
152452,12,257,1211000,Sideshow Bob,TV Studio,Big shoes to fill. Big shoes to fill. Big shoes to fill.
152453,12,258,1228000,Sideshow Bob,TV Studio,"You know, in ancient Greece, there was a school of thought called stoicist..."
152454,12,259,1230000,Bart Simpson,TV Studio,Wait a minute! You did it!
152455,12,260,1232000,Sideshow Bob,TV Studio,Excuse me?
152456,12,261,1235000,Bart Simpson,TV Studio,"Attention, fellow children. Krusty didn't rob that store. Sideshow Bob framed him and I got proof."
152457,12,262,1240000,Sideshow Bob,TV Studio,"Ow, my foot, you lousy, stupid, clumsy..."
152458,12,263,1245000,Bart Simpson,TV Studio,"See that? Krusty wore big floppy shoes but he's got little feet, like all good-hearted people."
152459,12,264,1251000,Bart Simpson,TV Studio,Sideshow Bob really fills his shoe with big ugly feet.
152460,12,265,1254000,Lou,TV Studio,The kid's right.
152461,12,266,1256000,Eddie,TV Studio,How do you figure we missed that?
152462,12,267,1258000,Chief Wiggum,TV Studio,"Get off your duffs, boys. Get down to that studio!"
152464,12,269,1261000,Sideshow Bob,TELEVISION STATION,"Yes, I admit it. I hated him. His hackneyed shenanigans robbed me of my dignity for years. I played the buffoon while he squandered a fortune on his vulgar appetites. That's why I framed Krusty. I would have gotten away with it too if it weren't for these meddling kids."
152465,12,270,1278000,Bart Simpson,TELEVISION STATION,"Take him away, boys."
152466,12,271,1280000,Sideshow Bob,TELEVISION STATION,Treat kids as equals. They're people too. They're smarter than you think. They were smart enough to catch me.
152468,12,273,1293000,Chief Wiggum,Jailhouse,"Well, we made a terrible, terrible mistake. Uh... won't happen again."
152469,12,274,1300000,Krusty the Clown,Jailhouse,"It better not, you dimwit."
152470,12,275,1301000,Homer Simpson,Jailhouse,"Krusty, I'm man enough to admit I was wrong, and I'm sorry I fingered you in court. I sincerely hope that the horrible stories I heard about what goes on in prison are exaggerated."
152472,12,276,1310000,Krusty the Clown,Jailhouse,"Well, the important thing is that I regained the trust of the children, but there was one boy who trusted me all along. Bart?"
152473,12,277,1318000,Bart Simpson,Jailhouse,"Yes, sir."
152474,12,278,1319000,Krusty the Clown,Jailhouse,Thank you.
