,episode_id,number,timestamp_in_ms,raw_character_text,raw_location_text,spoken_words
58140,237,297,1186000,Bart Simpson,STADIUM,"Okay, God. If you did give me a power, let it work now. Not just for me, but for my Dad."
58141,237,298,1196000,Bart Simpson,STADIUM,Heal... Heal... Heal...
58143,237,300,1199000,Football Announcer,FOOTBALL STADIUM,"Oh, doctor, with S. U. behind and seconds left, my supply of homespun sayings is lower than a doodlebug in Aunt Tillie's root cellar so we'll... Ohh, jumpin' crawdaddies! Is that Lubchenko comin' back on the field?"
58144,237,301,1215000,Lisa Simpson,FOOTBALL STADIUM,Bart did it! And they're gonna try for a field goal.
58145,237,302,1218000,Marge Simpson,FOOTBALL STADIUM,"A field goal? Hm... Nineteen, twenty, twenty-one... That would win the game!"
58146,237,303,1261000,Lubchenko,FOOTBALL STADIUM,I did it! I did it!
58147,237,304,1264000,Lubchenko,FOOTBALL STADIUM,My leg! It broke off!
58148,237,305,1268000,FAN,FOOTBALL STADIUM,Yes!
58149,237,306,1277000,Homer Simpson,FOOTBALL STADIUM,Poor guy. He lost his leg.
58150,237,307,1279000,Dr. Julius Hibbert,FOOTBALL STADIUM,"No, no, no. The fans will whoop it up with that leg tonight. You know, drink beer out of it and so on. But, uh, it'll turn up in the morning. And I'll sew it back on."
58151,237,308,1287000,Marge Simpson,FOOTBALL STADIUM,Will that really work?
58152,237,309,1288000,Dr. Julius Hibbert,FOOTBALL STADIUM,"Well, I assume so. As long as I have Bart's healing powers."
58153,237,310,1292000,Bart Simpson,FOOTBALL STADIUM,Why won't anybody listen to me? I don't have any special powers! I am not a healer!
58154,237,311,1298000,Dr. Julius Hibbert,FOOTBALL STADIUM,Fine. More money for me.
