,episode_id,number,timestamp_in_ms,raw_character_text,raw_location_text,spoken_words
412,33,305,1144000,Bart Simpson,Simpson Home,"Yeah, take care, man. Hey, thanks for coming. Hey, nice tie, Nelson.."
413,33,306,1147000,Nelson Muntz,Simpson Home,"Ah, thanks, it's your dad's."
414,33,307,1149000,Grampa Simpson,Simpson Home,"I tried to be a good baby-sitter, but I failed! I'm a feeb... a useless old... worn-out..."
415,33,308,1162000,Bart Simpson,Simpson Home,"Lisa, I have this strong unpleasant feeling I've never had before."
416,33,309,1166000,Lisa Simpson,Simpson Home,"It's called remorse, you vile burlesque of irrepressible youth."
417,33,310,1169000,Bart Simpson,Simpson Home,"Well, how do you make this feeling go away?"
418,33,311,1171000,Lisa Simpson,Simpson Home,You grab a bucket and a brush and clean harder and faster than you ever have before.
420,33,313,1183000,Homer Simpson,Catfish Lake,I AM THE CHAMPIONS / I AM THE CHAMPIONS / NO TIME FOR LOSERS / CAUSE I AM THE CHAMPIONS / OF THE WORLLLLD!
421,33,314,1196000,Homer Simpson,Catfish Lake,"Uh, oh."
422,33,315,1199000,Homer Simpson,Catfish Lake,"Hi, honey. Uh, oh. How's the marriage retreat going?"
424,33,316,1203000,Marge Simpson,Catfish Lake,"We came to this retreat because I thought our marriage was in trouble, but I never for a minute thought it was in this much trouble. Homer, how can you expect me to believe...."
425,33,317,1210000,Homer Simpson,Catfish Lake,"Marge, you don't know what this fish means. This fish represents a better life for both of us. This fish makes me a champion and a hero."
426,33,318,1217000,Marge Simpson,Catfish Lake,To who?
427,33,319,1218000,Homer Simpson,Catfish Lake,To those weirdos in the worm store.
428,33,320,1220000,Marge Simpson,Catfish Lake,All this fish represents is just how selfish you are.
429,33,321,1222000,Homer Simpson,Catfish Lake,"Well, if that's the way you feel... I'll throw it back."
430,33,322,1225000,Marge Simpson,Catfish Lake,"Oh yeah, sure."
431,33,323,1226000,Homer Simpson,Catfish Lake,Watch.
432,33,324,1229000,Homer Simpson,Catfish Lake,"Wow, I did it! I gave up fame and breakfast for my marriage. I fought it for six hours. She says one word and I toss it back. And you're telling me our marriage is in trouble? Come here, baby."
433,33,325,1246000,Marge Simpson,Catfish Lake,"Ohhh, Homer."
435,33,327,1272000,Homer Simpson,Simpson Home,We're back!
436,33,328,1273000,Lisa Simpson,Simpson Home,How's your marriage?
437,33,329,1274000,Homer Simpson,Simpson Home,Same as usual. Perfectomundo.
438,33,330,1277000,Marge Simpson,Simpson Home,"Oh my, the house looks wonderful. Grampa, what's your secret?"
439,33,331,1281000,Grampa Simpson,Simpson Home,"Pretending to cry. That's right, you heard me. Pretending to cry. I can turn it on and off like a fawcet. Boo-hoo, Oh, I'm crying, I'm so sad."
440,33,332,1295000,Lisa Simpson,Simpson Home,"Way to go, Grampa."
441,33,333,1296000,Bart Simpson,Simpson Home,I'll never trust another old person.
442,33,334,1298000,Grampa Simpson,Simpson Home,I fooled you. So long suckers. Hee hee hee.
444,33,336,1303000,Worm Man,BAIT SHOP,"Yup. General Sherman. They say he's 500 pounds of bottom-dwelling fury, don't you know? No one knows how old he is, but if you ask me, and most people do, he's a hundred years if he's a day."
445,33,337,1313000,Customer,BAIT SHOP,"And uh, no one's ever caught him?"
446,33,338,1314000,Worm Man,BAIT SHOP,"Well, one fella came close. Went by the name of Homer. Seven feet tall he was, with arms like tree trunks. And his eyes were like steel, cold and hard. Had a shock of hair, red, like the fires of hell."
