,episode_id,number,timestamp_in_ms,raw_character_text,raw_location_text,spoken_words
95133,367,2,92000,Myra,Skinner's Office,"Well, well, Bart Simpson in trouble again. School hasn't even started yet."
95134,367,3,97000,Bart Simpson,Skinner's Office,"What can I say? I missed you, Myra."
95135,367,4,99000,Bart Simpson,Skinner's Office,How's things with you and Frank?
95136,367,5,101000,Myra,Skinner's Office,That bum! He says his divorce will be final next week. So why is she pregnant again?
95137,367,6,106000,Bart Simpson,Skinner's Office,"Ouch. You hang in there, beautiful."
95138,367,7,108000,Bart Simpson,Skinner's Office,"So, where's the Skin-man?"
95139,367,8,110000,Myra,Skinner's Office,"He's out admiring his ""new"" car."
95141,367,10,113000,Seymour Skinner,Springfield Elementary School Parking Lot,"Ah, nineteen ninety-five. A fine year for Camrys. No one would ever guess you spent three months in a lake."
95144,367,13,127000,Bart Simpson,Skinner's Office,Ay carumba.
95145,367,14,131000,Bart Simpson,Skinner's Office,"Thank you, Satan!"
95147,367,16,139000,Bart Simpson,Springfield Elementary School,"Just think, Milhouse. From now on we'll always be ""those kids who got into the Steam Tunnels."""
95148,367,17,140000,Bart Simpson,Springfield Elementary School,Now I gotta warn you. We could get in trouble.
95149,367,18,155000,Milhouse Van Houten,Springfield Elementary School,I don't mind! Trouble's a form of attention.
95151,367,20,160000,Moe Szyslak,Moe's Tavern,"Gentlemen, the moment has finally arrived."
95152,367,21,163000,Moe Szyslak,Moe's Tavern,I'm rentin' a party bus and takin' all you regulars to Las Vegas.
95153,367,22,166000,Lenny Leonard,Moe's Tavern,Nevada?!
95154,367,23,166000,Moe Szyslak,Moe's Tavern,That's right.
95157,367,25,170000,Carl Carlson,Moe's Tavern,"Moe, why you bein' so generous? You're usually so stingy and rat-like."
95158,367,26,174000,Moe Szyslak,Moe's Tavern,"Yeah, well, ya remember that time I tried to hang myself and the rope broke? Well, I sued the rope company and got a huge settlement... and a new rope!"
95160,367,28,182000,Carl Carlson,Moe's Tavern,"Hey, nice rope."
95161,367,29,183000,Lenny Leonard,Moe's Tavern,You could hang a cow with that thing!
95163,367,31,186000,Milhouse Van Houten,STEAM TUNNEL,These steam tunnels are awesome. It's like we're in the school's lymphatic system -- and we're the lymph.
95164,367,32,194000,Bart Simpson,STEAM TUNNEL,"Oh, my God! My Dad had a long talk with me about this, but you can't believe it till you see it!"
95165,367,33,201000,Milhouse Van Houten,STEAM TUNNEL,The cafeteria loading dock!
95166,367,34,203000,Bart Simpson,STEAM TUNNEL,Look -- we're havin' pizza tomorrow!
95167,367,35,204000,Milhouse Van Houten,STEAM TUNNEL,I'm gonna eat a lighter breakfast.
95169,367,37,209000,Milhouse Van Houten,Boiler Room,"Well, we made it to the valve room. Now we can leave without touching a valve. What a tale that'll be."
95170,367,38,215000,Bart Simpson,Boiler Room,"Hey, we can't leave here without turning one little valve."
95171,367,39,219000,Milhouse Van Houten,Boiler Room,"Yeah, it'd be like going to Amsterdam and not taking a walking tour of famous doors."
95173,367,41,238000,Seymour Skinner,Springfield Elementary School Hallway,"Hmm, that's odd -- we only turn the heat on for parents' night."
95174,367,42,242000,Seymour Skinner,Springfield Elementary School Hallway,What the F-minus?
95175,367,43,251000,Seymour Skinner,Springfield Elementary School Hallway,Steeeaam!
95177,367,45,253000,Edna Krabappel-Flanders,Mrs. Krabappel's Classroom,"Grover Cleveland's second term was, if anything, more uneventful--"
95178,367,46,261000,Nelson Muntz,Mrs. Krabappel's Classroom,"Look, a new kid! Get him!"
95183,367,51,283000,Lisa Simpson,BAND ROOM,Our instruments are rusting!
95184,367,52,285000,Dewey Largo,BAND ROOM,"We're going a cappella, people!"
95185,367,53,298000,Kids,BAND ROOM,BOM BOM BOM BOM / BOM BOM BOM BOM
95186,367,54,298000,Ralph Wiggum,BAND ROOM,I've got two kinds of wet in my pants!
95188,367,56,304000,Groundskeeper Willie,Hallway,It's so hot... I need a drink.
95119,367,58,311000,Groundskeeper Willie,Hallway,No water fountain outwits Willie!
95156,367,59,316000,Groundskeeper Willie,Hallway,Maybe I'll just have a soda.
95191,367,62,326000,Seymour Skinner,Springfield Elementary School,This wood is more buckled than a pilgrim's hat. But who's responsible?
95192,367,63,334000,Seymour Skinner,Springfield Elementary School,Don't bother struggling -- I've got your scruff.
95193,367,64,338000,Bart Simpson,Springfield Elementary School,Can I cut a deal? I'll give you Milhouse.
95194,367,65,340000,Seymour Skinner,Springfield Elementary School,I don't want Milhouse.
95195,367,66,343000,Milhouse Van Houten,Springfield Elementary School,Sounds like my parents' custody hearing.
95198,367,69,349000,Bart Simpson,Skinner's Office,"Myra, can ya help me out here?"
95199,367,70,351000,Myra,Skinner's Office,Forget it. This used to be a Croissandwich. Now it's a ham and cheese car crash.
95200,367,71,357000,Seymour Skinner,Skinner's Office,"Yes, thank you, Myra. To highlight the seriousness of Bart's offense, Superintendent Chalmers will be joining us by video uplink."
95201,367,72,365000,Gary Chalmers,Skinner's Office,"And joining me by video uplink, State Comptroller Atkins."
95202,367,73,369000,State Comptroller Atkins,Skinner's Office,Can we move this along? I'm attending an important conference here in Scottsdale.
95203,367,74,373000,Gary Chalmers,Skinner's Office,You're in Scottsdale? I'm in Scottsdale! At the Hyatt -- room three eighty-one!
95204,367,75,377000,State Comptroller Atkins,Skinner's Office,"Get outta here! I'm in five oh-two! Hey, do you guys have any ice buckets down there?"
95205,367,76,383000,Gary Chalmers,Skinner's Office,"No, we've been using shower caps."
95206,367,77,385000,Gary Chalmers,Skinner's Office,Skinner!
95208,367,79,389000,Homer Simpson,Skinner's Office,You made that TV show really mad.
95209,367,80,391000,Seymour Skinner,Skinner's Office,"Yes, well you won't think it's so funny when we send Bart here."
95210,367,81,395000,Marge Simpson,Skinner's Office,Upward Bound: The toughest behavioral modification camp in Northwest Oregon.
95211,367,82,395000,Seymour Skinner,Skinner's Office,"It's the only place cruel enough to straighten Bart out. They use a proven concept, ""tough hate"", to turn around foul-mouthed hooligans. Then they send them home, quietly ticking away."
95212,367,83,413000,Homer Simpson,Skinner's Office,"Hmm, this camp's got it all -- climbing some kind of rope thing, wearing a backpack, high-fiving the black kid. It's the perfect thing to straighten you out."
95214,367,85,425000,Seymour Skinner,Skinner's Office,Got it!
95215,367,86,429000,Seymour Skinner,Skinner's Office,Now I have a ring tone for my brand new cell phone.
95216,367,87,433000,Seymour Skinner,Skinner's Office,No wires at all. Except this one.
95217,367,89,442000,Lenny Leonard,Moe's Tavern,"Hey, check it out -- I made it partially risqué."
95218,367,90,446000,Homer Simpson,Moe's Tavern,"Hey guys, I have to put the boy on a plane to soul-crushing camp, then I'll be back to go to Vegas!"
95219,367,91,452000,Bart Simpson,Moe's Tavern,"Dad, if you take me to Vegas, I'll teach you how to cheat at blackjack."
95220,367,92,455000,Homer Simpson,Moe's Tavern,"Boy, you don't need to cheat when you got a system."
95221,367,93,458000,Bart Simpson,Moe's Tavern,What's your system?
95222,367,94,459000,Homer Simpson,Moe's Tavern,I don't tell your mother how much I've lost.
95224,367,96,466000,Homer Simpson,Springfield Airport,One child to Portland! He's your problem now.
95225,367,97,471000,Desk Agent,Springfield Airport,It seems he was our problem before. Your son's on the no-fly list.
95226,367,98,477000,Homer Simpson,Springfield Airport,"Why, there must be some mistake."
95227,367,99,480000,Desk Agent,Springfield Airport,There's no mistake. It seems the last time he flew unescorted...
95229,367,101,484000,Pilot,Airport,Welcome to Atlanta.
95231,367,103,486000,Pilot,Plane,Please keep your seatbelt fastened until we have come to a complete stop.
95232,367,104,490000,Bart Simpson,Plane,Nobody tells Bart Simpson what to do.
95233,367,105,495000,Pilot,Plane,"Thanks a lot, thirty-three ""C"". Now we all have to go back to Minneapolis. And I'm very tired."
95236,367,108,505000,Bart Simpson,Airport,"Well Homer, looks like I can't go to discipline camp. Which is too bad, 'cause I think this was the thing that would finally straighten me out."
95237,367,109,513000,Homer Simpson,Airport,"Oh yeah?! You're going to that camp, 'cause I'm gonna drive you there."
95238,367,110,519000,Bart Simpson,Airport,"Yeah, that'll be way more fun than Vegas."
95242,367,114,526000,Carl Carlson,Moe's Tavern,"Aw dang, Homer ain't comin'."
95243,367,115,528000,Nelson Muntz,Moe's Tavern,Haw haw!
95244,367,116,529000,Carl Carlson,Moe's Tavern,And Nelson saw somethin' funny.
95247,367,119,544000,Homer Simpson,Car,Stupid Bart... makes me drive to Oregon... home of unspoiled forests... birthplace of Matt Groening ...
95248,367,120,550000,Bart Simpson,Car,"Dad, neither of us wanna go. Why are you doing this? Where's the old carefree Homer who likes to cut loose?"
95249,367,121,557000,Homer Simpson,Car,You mean Fun Homer? I'm afraid Serious Homer has him locked up till you're at your snooty torture camp.
95250,367,122,563000,Bart Simpson,Car,"Fight back, fun Homer! Together we can win!"
95251,367,123,566000,Homer Simpson,Car,It's no use.
95252,367,124,569000,Fun Homer,Car,"Aw c'mon, Serious Homer, let me out! We'll get a monkey drunk and push him down the stairs."
95253,367,125,576000,Serious Homer,Car,I'll kill you the way I killed intellectual Homer!
95256,367,128,586000,Marge Simpson,Bart's Bedroom,"While the boys are gone, we'll sell all their useless junk and replace it with knickknacks and curios."
95257,367,129,593000,Lisa Simpson,Bart's Bedroom,I already made up a yard-sale sign!
95258,367,130,596000,Marge Simpson,Bart's Bedroom,"You know, your father saved every book report he ever wrote. And every one was Stuart Little!"
95259,367,131,605000,Marge Simpson,Bart's Bedroom,Not to mention this Power Point demonstration he did just last week.
95260,367,132,616000,Lisa Simpson,Bart's Bedroom,My Malibu Stacy heads!
95261,367,133,619000,Lisa Simpson,Bart's Bedroom,"Oh no, Bart blamed this on the dog! I didn't pet him for weeks! Oh, I'm sorry I doubted you, boy."
95264,367,136,634000,Homer Simpson,Homer's Car,Eh.
95265,367,137,635000,Bart Simpson,Homer's Car,"C'mon, Dad, we got a long way to go. You can't stay mad at me the whole time."
95266,367,138,638000,Homer Simpson,Homer's Car,"Boy, if you were half as smart as you think you are, you'd clean up your act."
95267,367,139,642000,Bart Simpson,Homer's Car,Well maybe pulling pranks is the only thing I'm good at.
95268,367,140,645000,Homer Simpson,Homer's Car,"At least you have something you're good at. I'm thirty-eight years old, drivin' a crappy car, with a son who doesn't respect me, and I'm one Snickers pie away from losing my foot to diabetes. Mmm, Snickers pie."
95271,367,143,670000,Homer Simpson,ROADSIDE DINER,"So, I see you're also traveling with your son. What boy prison are you taking him to?"
95272,367,144,674000,Father,ROADSIDE DINER,"Actually, Justin and I are going to the Oregon Shakespeare Festival. Sir Peter Hall himself is directing."
95273,367,145,680000,Homer Simpson,ROADSIDE DINER,"See Bart, I told you things could be worse."
95274,367,146,683000,Son,ROADSIDE DINER,I'm getting a sweatshirt with Shakespeare's face on it!
95275,367,147,686000,Father,ROADSIDE DINER,"Well, we'd better get back to the Prius, son. Don't forget the menu for our scrapbook."
95277,367,149,696000,Bart Simpson,ROADSIDE DINER,Did you see that? They were eating melon for breakfast!
95278,367,150,700000,Homer Simpson,ROADSIDE DINER,"Look at me, I use a napkin."
95279,367,151,709000,Bart Simpson,ROADSIDE DINER,"Well Dad, we may not always get along, but we'll never be that lame."
95280,367,152,714000,Homer Simpson,ROADSIDE DINER,"I bet they're from Massachusetts. You know, it's legal there for a guy to marry his son."
95281,367,153,721000,Bart Simpson,ROADSIDE DINER,"Well, I guess it's tinkle time."
95282,367,154,723000,Homer Simpson,ROADSIDE DINER,"Don't forget to wash your hands, Shakespeare."
95284,367,156,730000,Cora,ROADSIDE DINER,"So, here for a snack before they roll you back into the ocean?"
95285,367,157,733000,Homer Simpson,ROADSIDE DINER,"Yeah, I'll have the smiley-face breakfast special."
95286,367,158,737000,Homer Simpson,ROADSIDE DINER,"Uh, but could you add a bacon nose? Plus bacon hair, bacon mustache, five o'clock shadow made of bacon bits... and a bacon body."
95287,367,159,745000,Cora,ROADSIDE DINER,How 'bout if I just shoved a pig down your throat?
95288,367,160,747000,Cora,ROADSIDE DINER,I'm kidding.
95289,367,161,749000,Homer Simpson,ROADSIDE DINER,Fine. But the bacon man lives in a bacon house!
95290,367,162,752000,Cora,ROADSIDE DINER,No he doesn't!
95292,367,164,758000,Homer Simpson,Diner,You know who would really like this place? Bart. Wait a minute... where the hell is Bart?
95294,367,166,767000,Homer Simpson,Men's Room,You little monster! Show your face this minute!
95296,367,168,776000,Homer Simpson,Bathroom Stall,"Bart, where are you?!"
95298,367,170,780000,Bart Simpson,Diner,"Hey Stavros, there's a guy in your bathroom tryin' to dine-and-dash."
95299,367,171,784000,Fry Cook,Diner,What?! No one dashie-dine on Stavros!
95300,367,172,789000,Homer Simpson,Diner,Why you little...
95301,367,173,791000,Homer Simpson,Diner,I'm stuck!
95302,367,174,792000,Homer Simpson,Diner,Ow! Someone's hitting my butt with something!
95304,367,176,794000,Stavros,Diner Bathroom,Is frying pan!
95307,367,179,800000,Homer Simpson,Restaurant,"Leave your ass, Homer. Leave your ass."
95312,367,181,805000,Comic Book Guy,Simpson Home,"Hmm, lemme get this straight. I get all of Bart's action figures, Homer's treasured Mr. Plow jacket , and these Power Rangers Underoos, which I am already wearing...for only three ninety-five?"
95313,367,182,816000,Marge Simpson,Simpson Home,That's right.
95314,367,183,817000,Comic Book Guy,Simpson Home,Give me five minutes alone with your fridge and you have a deal.
95315,367,184,820000,Marge Simpson,Simpson Home,Fine.
95316,367,185,822000,Lisa Simpson,Simpson Home,We've only brought in five dollars. And that came from Mr. Flanders buying back his own stuff.
95317,367,186,827000,Ned Flanders,Simpson Home,"My LP of ""Dreamcoat!"""
95318,367,187,829000,Ned Flanders,Simpson Home,HOW I LOVE MY COAT OF MANY COLORS / IT WAS RED AND YELLOW AND GREEN AND BROWN / AND SCARLET AND BLACK AND OCHRE AND PEACH / AND RUBY AND OLIVE AND VIOLET AND FAWN...
95319,367,188,845000,Ned Flanders,Simpson Home,...AND LILAC AND GOLD AND CHOCOLATE AND MAUVE / AND CREAM AND CRIMSON AND SILVER AND ROSE / AND AZURE AND LEMON AND RUSSET AND GREY...
95320,367,189,857000,Ned Flanders,Simpson Home,AND PURPLE AND WHITE AND PINK AND ORANGE / AND RED AND YELLOW AND GREEN AND BROWN / SCARLET AND BLACK AND OCHRE AND PEACH...
95321,367,190,865000,Marge Simpson,Simpson Home,My yard sale is a failure. I guess I'll have to give everything to the Salvation Army.
95322,367,191,871000,Salvation Army Driver,Simpson Home,We don't want it!
95323,367,192,873000,Otto Mann,Simpson Home,Dexonumb? Somnodoze? Percolax? Are these for sale?
95324,367,193,879000,Marge Simpson,Simpson Home,I guess -- they're Homer's expired pain medications.
95325,367,194,882000,Otto Mann,Simpson Home,"Oh, I'm in a lotta pain. I'm, uh, breaking in a new pair of flip flops, and my thong notch is on fire! How much?"
95326,367,195,890000,Marge Simpson,Simpson Home,A dollar.
95327,367,196,892000,Otto Mann,Simpson Home,"Per pill, right?"
95328,367,197,893000,Marge Simpson,Simpson Home,Uhh... yeah!
95329,367,198,894000,Otto Mann,Simpson Home,I'll take a dozen of each.
95330,367,199,896000,Otto Mann,Simpson Home,Oh wow! Drugs in a bottle. I feel like Elvis Presley.
95332,367,201,902000,Snake Jailbird,YARD SALE,Whoa! This is so much safer than buying my illegal drugs at the playground.
95333,367,202,907000,Marge Simpson,YARD SALE,Bag or keister?
95334,367,203,908000,Snake Jailbird,YARD SALE,Surprise me.
95335,367,204,910000,Waylon Smithers,YARD SALE,"Um, I'll take all your estrogen."
95336,367,205,913000,Marge Simpson,YARD SALE,That's a female replacement hormone.
95337,367,206,916000,Waylon Smithers,YARD SALE,It's for... a friend. Who's trapped in the body of another friend.
95309,367,209,921000,Homer Simpson,Homer's Car,"So Lenny, how's it goin' in Vegas? Pretty boring, I'll bet."
95340,367,211,925000,Lenny Leonard,Las Vegas Casino,"Yeah, kinda..."
95342,367,213,937000,Lenny Leonard,Las Vegas Casino,"Can't talk now, Homer. I'm too satisfied in every way."
95344,367,215,950000,Homer Simpson,Las Vegas Casino,"I've got you now, boy."
95351,367,222,971000,Homer Simpson,Cliff,Boy! Push down on the bumper! Then I can back the car up and save myself.
95352,367,223,976000,Bart Simpson,Cliff,"Hm, if I save you, what are you gonna do to me?"
95353,367,224,979000,Homer Simpson,Cliff,Shower you with love because this experience has taught me just how precious you are.
95354,367,225,986000,Homer Simpson,Cliff,I'll kill you! I'll kill your whole family!
95355,367,226,989000,Homer Simpson,Cliff,"Kidding! I'm kidding! We can do that, we have a special friendship."
95356,367,227,994000,Homer Simpson,Cliff,I'm gonna double kill you! And then I'm gonna bury you in a shallow grave. Then I'll dig you up and kill you again! That's the beauty of a shallow grave.
95357,367,228,1003000,Homer Simpson,Cliff,"You sweet little angel. Oh, I'm gonna rip your head off. And spit down your adorable little neck. Because I wanna smash your little stupid head. Oh, but I love you we'll go on a fishing trip. But first I'm gonna put you on a sawmill then punch your little face out. That's what I'm gonna do!"
95359,367,230,1033000,Jimbo Jones,Simpson Home,"I'm here for the, uh, yard sale?"
95360,367,231,1035000,Marge Simpson,Simpson Home,That was yesterday.
95361,367,232,1037000,Jimbo Jones,Simpson Home,"No, I mean yard sale."
95362,367,233,1040000,Marge Simpson,Simpson Home,What are you talking about?
95363,367,234,1042000,Jimbo Jones,Simpson Home,Can I buy some pills?
95364,367,235,1043000,Marge Simpson,Simpson Home,"Well, maybe someone else can help you, but I am not a drug grocer!"
95365,367,236,1052000,Marge Simpson,Simpson Home,I'm out of drugs! See how much money I made?!
95366,367,237,1055000,Marge Simpson,Simpson Home,"Oh. Chief Wiggum. Uh, are you still with the police department?"
95367,367,238,1061000,Chief Wiggum,Simpson Home,"Save it, Ma Peddle!"
95368,367,239,1064000,Lou,Simpson Home,Ma Peddle?
95369,367,240,1065000,Chief Wiggum,Simpson Home,It's a reference to Ma Kettle. The popular movie character from the forties.
95370,367,241,1068000,Lou,Simpson Home,"If you have to explain it, it's not good, Chief."
95372,367,243,1071000,Homer Simpson,Homer's Car,"Well boy, you made the right choice. I think this is the first step to a new, closer relationship between us."
95373,367,244,1078000,Bart Simpson,Homer's Car,"Dad, I think you actually enjoy seeing your own son suffer."
95374,367,245,1081000,Homer Simpson,Homer's Car,"I don't enjoy it. Being a father is just a job. Long hours, no pay, and at the end, all you get is someone yelling ""you screwed me up""!"
95375,367,246,1090000,Bart Simpson,Homer's Car,"Well, maybe if you enjoyed me more, I wouldn't be so screwed up."
95376,367,247,1093000,Homer Simpson,Homer's Car,"Hey, I enjoy you plenty."
95377,367,248,1095000,Homer Simpson,Homer's Car,Talking time is over.
95379,367,250,1103000,Commandant,UPWARD BOUND CAMP,"Don't worry, Mr. Simpson. We're gonna take his ""sass"" and turn it into ""siss."""
95380,367,251,1104000,Homer Simpson,UPWARD BOUND CAMP,"Thank you, Colonel."
95381,367,252,1108000,Commandant,UPWARD BOUND CAMP,"I'm not a Colonel. This is a Boy Scout uniform that I ""dolled up."" Come with me, son."
95382,367,253,1115000,Commandant,UPWARD BOUND CAMP,Now kiss your childhood goodbye.
95384,367,255,1136000,Homer Simpson,Highway,Woo hoo! Vegas here I come!
95385,367,256,1145000,Bart-Jack,Highway,"I miss you, Dad."
95386,367,257,1148000,Bart-waitress,Highway,"Hey Homer, you wanna eat my shorts?"
95387,367,258,1161000,Bart Head,Highway,"Don't gamble on my love, Homer!"
95388,367,259,1166000,Homer Simpson,Highway,I miss Bart! I can't leave him in that awful camp!
95389,367,260,1171000,Homer Simpson,Highway,"I'm comin', boy!"
95390,367,261,1178000,Homer Simpson,Highway,I bet this looks cool from overhead though.
95392,367,263,1183000,Homer Simpson,Homer's Car,"Woo hoo! Vegas here I come! Oh right, Bart."
95394,367,265,1194000,Commandant,UPWARD BOUND CAMP,"Nicely chopped, Simpson."
95395,367,266,1199000,Bart Simpson,UPWARD BOUND CAMP,I've learned so much in my three hours here. I don't have to play pranks to feel good. I can just listen to the gentle rhythms of nature.
95396,367,267,1210000,Homer Simpson,UPWARD BOUND CAMP,Stupid horse! It's a deer crossing!
95397,367,268,1213000,Homer Simpson,UPWARD BOUND CAMP,"Wipe the blood off the windshield and get in the car, boy!"
95398,367,269,1216000,Bart Simpson,UPWARD BOUND CAMP,Dad?
95399,367,270,1217000,Homer Simpson,UPWARD BOUND CAMP,"Son, I'm doing something I should have done a long time ago... taking you to Vegas!"
95400,367,271,1223000,Bart Simpson,UPWARD BOUND CAMP,I'm gonna order a steak dinner and eat it on the toilet!
95401,367,272,1226000,Homer Simpson,UPWARD BOUND CAMP,And don't you try to stop us.
95403,367,273,1227000,Commandant,UPWARD BOUND CAMP,"Actually, we were gonna call you, Mr. Simpson. Your credit card was declined."
95404,367,274,1231000,Homer Simpson,UPWARD BOUND CAMP,Try this one...
95406,367,276,1238000,Marge Simpson,Simpson Home,"Homer, I hope you get this. I'm in jail and I need ten thousand dollars bail. Hurry!"
95407,367,277,1244000,Homer Simpson,Simpson Home,"Uh, Marge. Me and Bart got in a fight with this really un-cool pit boss, and now we're in Nevada State Prison. Also, I don't know where Bart is. If you see him, say ""hey."""
95408,367,278,1254000,Lisa Simpson,Simpson Home,"Well Maggie, I always knew it would some day boil down to just you and me. I'll look for work in the morning."
