,episode_id,number,timestamp_in_ms,raw_character_text,raw_location_text,spoken_words
5340,49,285,1089000,Cesar,LIVING ROOM IN FRANCE,Formidable!
5343,49,287,1098000,Homer Simpson,Simpson Home,"Oh, every note is like a dagger in my heart. I gotta get outta here."
5345,49,289,1102000,Moe Szyslak,Moe's Tavern,"Moe's Tavern, Home of the Super Sunday Brunch Spectacular."
5346,49,290,1106000,Barney Gumble,Moe's Tavern,Oh! Baloney. Bread!
5347,49,291,1109000,Moe Szyslak,Moe's Tavern,Gotcha ya down for forty bucks. Good luck Your Eminence.
5348,49,292,1113000,Moe Szyslak,Moe's Tavern,"Sorry, Homer, you can't take any more of my money. I'm, uh, outta the bookie business."
5349,49,293,1117000,Barney Gumble,Moe's Tavern,"But Moe, you've been taking bets all..."
5350,49,294,1119000,Moe Szyslak,Moe's Tavern,"Hey Barney, how 'bout a free beer?"
5351,49,295,1121000,Barney Gumble,Moe's Tavern,Wow!
5352,49,296,1122000,Homer Simpson,Moe's Tavern,"Don't worry, Moe. I'm not bettin'."
5353,49,297,1124000,Moe Szyslak,Moe's Tavern,What? Gimme that.
5355,49,299,1127000,Homer Simpson,Moe's Tavern,"I had the greatest gift of all, a little girl who could pick football and I ruined it."
5356,49,300,1133000,Bret,Moe's Tavern,"Well sir, we're two hours and forty-five minutes into the pre-game show and we've got ourselves a special guest. Actor Troy McClure, whose new sitcom is premiering tonight -- coincidentally enough, right after the game!"
5357,49,301,1143000,Troy McClure,Moe's Tavern,"Thanks, Bret. My new show's called ""Handle with Care"". I play Jack Handle, a retired cop who shares an apartment with a retired criminal. We're the original odd couple!"
5358,49,302,1152000,Bret,Moe's Tavern,What made you want to do a situation comedy?
5359,49,303,1154000,Troy McClure,Moe's Tavern,"Well, I fell in love with the script, Bret, and my recent trouble with the IRS sealed the deal."
5360,49,304,1159000,Bret,Moe's Tavern,"Could be another Drexel's Class. Ooh, looks like we're almost ready for the kickoff."
5361,49,305,1164000,Football Announcer,Moe's Tavern,"Dallas kicks -- oh, it's a bad kick, way too short. Buffalo's going to start with excellent field position."
5362,49,306,1170000,Homer Simpson,Moe's Tavern,Buffalo's gonna win. Lisa hates me!
5363,49,307,1173000,Larry,Moe's Tavern,Whatcha got riding on this game?
5364,49,308,1175000,Homer Simpson,Moe's Tavern,My daughter.
5365,49,309,1177000,Larry,Moe's Tavern,What a gambler.
5366,49,310,1180000,Football Announcer,Moe's Tavern,That was the score at the half. Buffalo fourteen: Dallas seven.
5368,49,312,1180000,Football Announcer,Simpson Home,It's time for the never tedious Super Bowl halftime show.
5369,49,313,1189000,Alien,Simpson Home,"People of Earth, we've come ten billion light years to bring you this halftime message of peace."
5342,49,314,1197000,Bart Simpson,Simpson Home,"Oh, this sucks. C'mon snipers. Where are you?"
5370,49,315,1211000,Lisa Simpson,Simpson Home,"Bart, who's winning?"
5371,49,316,1213000,Bart Simpson,Simpson Home,"""You hate dad"" is up by a touchdown."
5373,49,318,1215000,Barflies,Moe's Tavern,Go! Go! Go! Go! Go! Yea!!
5374,49,319,1219000,Duff Announcer,Moe's Tavern,It's a touchdown for half-back Dan Beer-dorf! Duff Dry has won the Duff Bowl!
5375,49,320,1228000,Moe Szyslak,Moe's Tavern,They wanted it more.
5376,49,321,1229000,Barney Gumble,Moe's Tavern,"Hey Homer, didn't you say if Duff Dry wins, your daughter loves you?"
5377,49,322,1232000,Homer Simpson,Moe's Tavern,Not Duff Dry... Dallas.
5378,49,323,1234000,Barney Gumble,Moe's Tavern,"Okay, okay. They're both great teams."
5379,49,324,1237000,Homer Simpson,Moe's Tavern,Huh?
5380,49,325,1239000,Football Announcer,Moe's Tavern,Touchdown Cowboys!
5381,49,326,1241000,Homer Simpson,Moe's Tavern,"All right, we're back in business."
5383,49,328,1245000,Rev. Timothy Lovejoy,First Church of Springfield,"Well, I'm glad some people could resist the lures of the big game."
5384,49,329,1249000,Man,First Church of Springfield,"Oh my God, I forgot the game!"
5386,49,331,1251000,Football Announcer,Moe's Tavern,"So, with three ticks left on the clock, it all comes down to this one play. If Dallas scores here, happy fans'll be looting and turning over cars in the Lone Star state tonight. Here's the handoff."
5387,49,332,1261000,Homer Simpson,Moe's Tavern,"Please, please, please..."
5388,49,333,1262000,Football Announcer,Moe's Tavern,Touchdown! Stick a fork in this one. It is done. The Dallas Cowboys wins Super Bowl twenty-nine.
5390,49,335,1268000,Bart Simpson,Simpson Home,I guess you love dad.
5391,49,336,1269000,Lisa Simpson,Simpson Home,I suspected as much.
5393,49,338,1271000,Homer Simpson,Moe's Tavern,Yes! She loves me! She loves me!
5394,49,339,1274000,Moe Szyslak,Moe's Tavern,What are you so happy about Homer? You didn't win any money.
5395,49,340,1277000,Homer Simpson,Moe's Tavern,"Money comes and money goes, but what I have with my daughter can go on for eight more years!"
5397,49,342,1286000,Lisa Simpson,Mt. Springfield,"Come on, Dad!"
5398,49,343,1292000,Homer Simpson,Mt. Springfield,It's beautiful.
5399,49,344,1295000,Lisa Simpson,Mt. Springfield,Isn't it though?
5400,49,345,1296000,Homer Simpson,Mt. Springfield,After I catch my breath... can we... go... home?
