,episode_id,number,timestamp_in_ms,raw_character_text,raw_location_text,spoken_words
11369,70,313,1283000,Marge Simpson,HOSPITAL WAITING ROOM,"Oh, that's wonderful!"
11370,70,314,1289000,Angry Man,HOSPITAL WAITING ROOM,Dr. Nick Riviera. Remember me?
11371,70,315,1292000,Dr. Nick Riviera,HOSPITAL WAITING ROOM,Well if it isn't my old friend Mr. McGreg -- with a leg for an arm and an arm for a leg.
11373,70,317,1303000,Lisa Simpson,Intensive Care Corridor,"All right, Dad!"
11374,70,318,1305000,Bart Simpson,Intensive Care Corridor,You rule intensive care!
